id,source,text,annotator1_label,annotator2_label,annotator3_label,final_label
18016,YouTube,"lowkey loving this feature, thanks openai",,,,
5411,YouTube,To think that some people have to use ChatGPT on this question blows me away,,,,
8686,YouTube,The plegerism and ai detection is a nonsense thing. Let the people read anything or be cheated. They are not going to die anyway. They are simply stoping the people not to do things and making evetything hard.,,,,
17291,YouTube,this is so relevant right now,,,,
28588,YouTube,What about teachers in states where collective bargaining is illegal? Will there be opportunities in those states for teachers who are not allowed to join AFT?,,,,
19877,YouTube,"Completely useless content farming video that doesnt answer the questions it puts forward at the start. Do not give engagement, ignore and move on.",,,,
13866,Quora,"Not really. Final test will be the same as before. Just students who did not do homework will likely have much more difficult time passing test. Also in so,e countries and school homework is not graded so gpt chat will not make any difference for grades. On the other hands AI can also help students to understand some thing that they cannot find anwer from after searching throught a lot of books. So AI can atually be good for good students and will likely be bad for bad students.",,,,
6941,Reddit,Almost all my internal learners hate it and tank the engagement score. The ai voice is not the worse but the avatars draw universal hate even the director who pushed for it initially. We won’t dare to launch any of those content to external customer training yet.,,,,
17672,Twitter,"@hunsucker_adam @speedcxla @SophieMe0ws @nocontextmemes You're not listening to anyone so here are 4 AI's (gpt, copilot, DS, grok), a math teacher, and a college math professors proving you're wrong https://t.co/5RVhfB9H0j https://t.co/Q4se3zCgW4 Anything else you have to say is either ignorance or ragebait, so I pray for the latter https://t.co/tCRQ93JJLC",,,,
24749,Quora,"Schoolteachers create problems for their students to solve. AI solves the schoolteacher problems like calculators give correct arithmetic answers. One expert stated that AI solved military problems. No, it did not. The military have many, many problems based on killing people and destroying homes and infra-structure. They do npt have a clue how to not kill people or destroy people's homes and livelihoods. The same bloke seems to think that AI solves medical problems. That is like saying doctors can heal people. The world of January 2025 is in a big fat mess now that the USA have a new president and Elon Musk has his ear. ""THEY"" just created the Star Gate program. Do you think AI will solve problems in this program? For sure it will. But what problems will it solve? I am a simple minded human. I understand arithmetic OK, and I have a good grasp on consciousness and my own mind/body/spirit complex. I am not too bright with IQ or love though. However, what I do know for sure is that reality is a thought construction. I can think up problems to be solved or I can think there are no problems, and thus no need for solutions. I gave up on doctors at the end of the twentieth century because my doctor had been trying to find cancer in me for 6 years. At the beginning of 2000 I decided that I did not have cancer and have never seen a doctor since. In 2012 though, I did go back to my doctor for a medical checkup. He was dead. 15 years younger than me but he probably died of cancer because that was the problem that he was creating. I don't know for sure how he died because the other doctor would not tell me. He also would not pass me in a medical exam so I could not take the job that was offered to me. The world is in a mess because our science has artificial intelligence instead of organic intelligence. They just keep on creating crap because they can do it. Imagine creating an atomic bomb. Destroying a city of 80,000 people, and then building more of the bombs and increasing their destructive power for the next 80 years.",,,,
23919,YouTube,"There needs to be 100% human, 0% AI junk.",,,,
22606,YouTube,Ai are taking over the world and I will not let that happen!~,,,,
6592,Twitter,Harvard Astrophysicist Avi Loeb: Why UFOs May Be AI https://t.co/YQMbAc3cM2,,,,
23362,YouTube,"!0! = rest """,,,,
10215,Quora,"AI will become more commonplace and will be embedded in more things. Patterns identified by machine learning will inform lots of applications that are not themselves AI. Customer service call centers will be replaced by chat bots. Other jobs that are replaced by AI will become jobs that use AI. In the same way that the computer and then the Internet became pervasive, AI will become pervasive. Self driving cars will become more commonplace. AI will become more consumer oriented. There will be an iPhone app that answer more personal questions.",,,,
13075,YouTube,whoa these tools are insane,,,,
22010,YouTube,Hi Tony foltyn,,,,
12237,Quora,"Plato hated writing because it weakened memory. We've seen open book tests, to distinguish memorization from understanding. Today AI is just another tool. Further perspective: In Medieval times, students sought and paid scholars to be taught. It was about the learning, NOT about getting credentials. We must put schools back in the teaching-only business. Get rid of stupid teachers who lack the reputation to be paid by students. Like the trades, let ALL workers have apprenticeships so those who pay them can judge.",,,,
14356,YouTube,Then let them live there lives travel and experience life then go to college lol,,,,
16960,YouTube,"I switched to Ryne AI Humanizer after being disappointed with other tools, and the improvement in quality was noticeable.",,,,
14795,YouTube,"My teacher talked about it last Friday. At this point in the year, she says she can recognize our writing.",,,,
3966,Twitter,"Jean-Claude, 2025 Impact Award winner, shares his top #ISTELive25 takeaways: co-designing edtech, championing neurodiversity, &amp; pushing AI beyond teacher efficiency to transform curriculum &amp; pedagogy in math, science, reading. Dive in: https://t.co/3arog3LvW9 https://t.co/dPGPcdZBNy",,,,
8124,YouTube,Fr. Finally. I'm sick of the older generations whining at us for not being an exact clone of them.,,,,
7363,LinkedIn,"The most important AI question for education is not what tools to adopt. It is what outcomes still matter when information is unlimited. Critical thinking, judgment, ethics, and applied problem solving rise in value when content becomes cheap. Degrees and certificates must reflect that shift or risk losing relevance.",,,,
2099,YouTube,Nobody will have jobs in 2 years so they won’t have to Worry about asking Alexa anything. This dude is clueless,,,,
11079,YouTube,"According to my database, Google Gemini, formerly known as Bard has had multiple updates and is very successful.",,,,
690,YouTube,she is all ready a robot,,,,
19278,YouTube,"I am a retired Controls Engineer. My degree is Electrical Engineering. Early in my career a Sr. Engineer said to me as a new EE. “Technology is transferred in skin bags.” The internet is a useful search tool. It’s not a teaching tool. AI does not have institutional knowledge ( yet?) My lead engineers, and especially my electric and instrument shops taught me how to be a good Controls Engineer. My Vendors taught me about new tools. Teachers are everywhere, if you are willing to listen.",,,,
18151,YouTube,Hii mam! I am a student learning AI/ML at Moonpreneur and I must say that you have explained the meaning of AI in the simplest manner ever.,,,,
7541,YouTube,Share me the link please,,,,
19283,YouTube,"wow what a crap presentation. Not TED level, it's barely first year college level. Not much in the way of the catastrophic risks at all. and a poor explanation of his 'solution' - insanely naive",,,,
7217,Twitter,"¡Feliz Día dl Instructor d Arte! homenaje a todos los instructores d arte q inspiran y guían a sus estudiantes a explorar su creatividad. Su dedicación y pasión x el arte no solo enseñan técnicas, sino q también fomentan la expresión personal y la apreciación estética. #Cuba https://t.co/2e9cERG9IO",,,,
236,YouTube,Is this possible in ChatGPT? Because I know you can’t view live website in chat for so google Gemini is pretty cool,,,,
2327,LinkedIn,🧠 Learning Outcomes Measurement Suite — built with the SCALE Initiative at Stanford University and University of Tartu to detect “learning moments” inside real student–AI interactions and track how learning behaviors evolve over time.,,,,
23195,Twitter,"@Dennis_W_Wise Yeah, at least if they rely on the kind of homework and unproctored exams I've been using. For my Astronomy labs, the AI really can't help them, and maybe I'll have to increase the weight of the labs over exams. All the sordid details here: https://t.co/a2zr3abMnV",,,,
20680,LinkedIn,"• A district layer with integrations and a knowledge graph that grounds AI in local policies, curriculum, and standards",,,,
1930,YouTube,I thought this was going to be a review of several language apps. It’s an inaccurate title and an advertisement for langua,,,,
7502,YouTube,seriously can't believe i never heard of this,,,,
2209,Twitter,@Legauche Acho provável que um um dia algum LLM seja capaz de ensinar as pessoas a ler e a escrever em qualquer lugar e qualquer hora com a paciência que um professor não teria.,,,,
1030,YouTube,Stop the hype and do something else,,,,
28169,YouTube,I'm impressed. Your AI generated avatar is quite realistic.,,,,
10828,YouTube,How often do you use AI tools? Have your habits changed over time?,,,,
2322,YouTube,"AI is not that far anyway! AI is doable with ""single"" task and isn't able to do complex task, like teach and act autonomously and have conversations about subject! But it is coming!",,,,
16848,YouTube,"Once the students realize they can build Microsoft sized tech business ALONE using AI agents, all retarded educational faculties will perish to exist. 😂😂😂😂 so long suckers. Nobody needs your outdated indoctrination school system anymore. It’s already dead and you don’t know it yet. Hahahaha",,,,
7799,LinkedIn,Metacognitive knowledge (i.e. knowing how poor AI use can reduce learning) correlates to both academic performance and age.,,,,
9126,YouTube,The rich will become richer courtesy AI.,,,,
21922,YouTube,yo i need to check out that midjourney thing,,,,
15907,YouTube,Tool or web site,,,,
7021,YouTube,"gpt5 is just as poor when it comes to this aspect, I tested it for it, and I believe others did too",,,,
17670,Twitter,"@GriffethJe41981 @DollieDepp @jose112y @misskarenpage @alison6043 BECAUSE A YOUNGER PERSON DOESN'T PREY ON A FUCKING OLDER PERSON the same way the student doesn't prey on a teacher my God, educate yourself, however I know thinking is not Deppies' greatest quality Even Google AI Overview says so https://t.co/vRGlghQJEO",,,,
4336,YouTube,Don't knock it till you try it,,,,
23703,YouTube,ngl this made me less stressed about ai,,,,
18712,YouTube,"Great points on struggle and illusion of competence. But treating learning as an optimization problem misses what I see daily in classrooms here in Korea. Learning is social. No amount of data replaces discussion, accountability, and shared effort.",,,,
18882,YouTube,Insane editing and research wow,,,,
15489,YouTube,"COMMENT: Did you cram for your latest exam? 📖 Also, make sure you check out my Youtube Shorts! I am posting daily vlogs there 😘❤ Remember, if you want to excel in difficult subjects fast, Brilliant is the best platform to do just that~ Go to https://brilliant.org/fayefilms to get a 30-day free trial + the first 200 people will get 20% off their annual subscription ✍",,,,
7963,YouTube,this could be a game changer for studying,,,,
25711,YouTube,College was already worthless.,,,,
15499,YouTube,6.07 this was a recent assignment on my Masters programme. The instructor provided us with an AI generated essay on a subject covered on the module and we had to critique it. It was very interesting but surprisingly difficult as even the errors in the AI generated essay were presented very strongly,,,,
26461,Twitter,University of Hawaii says a ransomware gang stole data on ~1.2M people after breaching its Cancer Center’s Epidemiology Division in Aug 2025. SSNs & DL numbers from research files were accessed. Clinical ops & student records unaffected. UH paid for decryption. #databreach https://t.co/Lna6XzOZLS,,,,
13339,YouTube,"The downside with AI plagiarism checkers and detectors is that they are trained to flag anything that is too formal as AI or plagiarised. And guess what is too formal? Research papers, university works, theses. All these are formal and therefore can get flagged by AI as plagiarized or copy pasted. Because these AIs are supposedly trained using academic materials.",,,,
6240,YouTube,Stop freaking out we always had the answers. What is important is when you got those answers and did you learn it.,,,,
3091,Twitter,For 8months I have been using GPT-4 series for myself and also for school projects. It’s human like intelligence created a beautiful understanding which helped me in content creation also. Some useless organisations framing it with manipulation. #keep4o https://t.co/7s7ea04VNm,,,,
3177,Twitter,"For academic purposes - Claude Sonnet 4.6 is far far far better than ChatGPT 5.2 on any given day. The multiple dimensions, the depth, the contextual understanding it brings in its responses is insane ! 🔥 💯 @AnthropicAI @claudeai @DarioAmodei @OpenAI @sama @ChatGPTapp",,,,
21594,YouTube,Creativity is the new normal❤,,,,
14125,Twitter,📢#CallforPapers! 🤖Advanced Fault and Error Detection Techniques Using #MachineLearning and #ArtificialIntelligence 🔗More Info: https://t.co/XNhyO231vW 📅Deadline for submissions: 31 May 2026 Guest Editor from International Hellenic University #AI #ML #FaultDiagnosis #robotics https://t.co/itXVdhw13I,,,,
11610,YouTube,Just take my money already.,,,,
13880,YouTube,"AI will not replace teachers ever. Teachers do so much more than disseminate information and create content. Teachers actually educate students. Teachers navigate maladaptive student behaviors every day that interfere with learning. Teachers teach students how to think critically. Teachers inspire and encourage student performance. Teachers are coaches, counselors, and educators. We do far more than give exams. We shape the minds, behaviors, and learning experiences of students every day. True learning requires humans interacting with their environment and other humans. AI will be nothing more than just another learning tool that teachers utilize to educate their students. Nothing more, nothing less.",,,,
13471,YouTube,A fern could replace some teachers.,,,,
15304,YouTube,clear cut narration on Al: Thank you sir I,,,,
28307,YouTube,"Well, That could work but yeah it would take alot of money and probably alot of engineering challenges. Also, solar panels aren't very good in terms of energy use",,,,
23891,YouTube,None of this feels illegal,,,,
1776,YouTube,You kept calling it chat GTP from time to time. Good advice regardless though,,,,
22065,YouTube,guys don't listen use answer ai,,,,
21413,YouTube,@boodleboxaiDoes quillbot give the same results as Turnitin? Is it reliable?,,,,
21175,YouTube,"Sam Altman is an absolute Slimebag .. He and Musk, Thiel, Zuckerberg and Karp are all the destroyers of dreams.",,,,
3225,YouTube,you didn’t do human beings on AsMr,,,,
1987,YouTube,"I am very disappointed by your suggestion. I thought you were trustworthy, so I signed up for SciSpace, which only offers paid subscriptions for any substantive work. I ended up joining their premium account, but soon after that, it could not even generate simple revision-outline suggestions for an article. It keeps failing and does not work at all. I am extremely disappointed by your suggestion, and you should disclose whether you receive any monetary incentive from these companies to make your recommendations appear credible since SciSpace was below the stanard and did not work at all. What a waste of time watching your video, and from joining it and having to cancel via human agents...",,,,
13194,YouTube,"This must be done immediately. Teachers’ mental health can’t last much longer. Change schools systems to have all ‘mainstreamed & requiring students sitting quietly treated the same’ paradigm is just not working. Human teachers should only have 5 students max. Even then they should be allowed to do their own projects independently like college. Lectures should be minimised. Teachers should be knowledge assessors, consultants & curators only not counsellors or lawyers or gaolers.",,,,
23863,YouTube,"ChatGPT gets flagged always, purify-text is my savior",,,,
11119,YouTube,i always struggle with learning tech stuff lol,,,,
26234,YouTube,"Research Rabbit, Paperpal, Jenni,Avidnote, scispace",,,,
28236,LinkedIn,"With Gemini in test prep, India’s education businesses have little time to lose https://lnkd.in/dG7ZnudP",,,,
3581,YouTube,One of the worst language talk!!. I,,,,
8148,Twitter,Join our instructor Jino Joseph for a live masterclass and uncover the prompting hacks that transform Microsoft 365 Copilot into your ultimate productivity partner. Save your spot today: https://t.co/otgJrBS1Ra #MicrosoftCopilot #PromptingTips #Microsoft365 #NetComLearning https://t.co/7ISYveDEnF,,,,
6279,YouTube,Do you think AI will replace your job? 🤖,,,,
6233,YouTube,why did he snitch,,,,
17574,YouTube,Why You Chasing Me,,,,
14701,YouTube,No comment about Chat GPT ?,,,,
4594,YouTube,"Unfortunately it is a catch 22. We are saying AI can help learn if the student can judge what to pick from AI... How can students judge what's valuable if they are learning? AI is a good assistant to an expert, students, by definition, are not experts in the topic they are studying yet.",,,,
13825,LinkedIn,"On Feb. 26 at 12:00 PM ET, MagicSchool and edWeb are hosting a live edLeader Panel on leading safe and responsible AI decisions in schools and districts.",,,,
6013,LinkedIn,"AI isn’t just changing how #audit and #practices work, it is also reshaping learning across #industry.",,,,
9128,YouTube,I am from libya And that not right,,,,
15160,YouTube,its not even art,,,,
8186,YouTube,MRP bolo bhaiya,,,,
28656,YouTube,Listening to this guy talk is exhausting,,,,
2471,YouTube,"If a person's skill is limited by what the ai can do, aka they did all their assignments and tasks using ai, so they don't know anything themselves... Then why would the employer just not use the same ai? Why would the employer want to pay this guy for just being a layer between him and an ai who actually does everything?",,,,
14521,YouTube,What's thebai name?,,,,
26478,Twitter,@yoonzino444 can finish before the dl po!,,,,
28225,YouTube,This was a great video but the animations were just amazing,,,,
28049,YouTube,"turnitin’s okay, but Winston AI’s been my go-to lately for fast and clear plagiarism results",,,,
18034,YouTube,"There are a bunch of very longwinded tl;dr comments here, by channels with no avatar, content or ""About"" info, written in the same kind of tone. Wouldn't be surprised if it's bots or the same person., or AI.",,,,
3209,YouTube,this is kinda wild to see on campus,,,,
1658,YouTube,trade schools might actually be the move,,,,
21370,YouTube,Winston AI is one of the most accurate AI detectors out there. It does a great job at spotting AI-generated content compared to others like Turnitin or GPTZero.,,,,
17714,YouTube,Ai is the equivalent of deciding to get a shed but instead of going to Home Depot and building it you order one off temu because it’s cheaper and convenient,,,,
27395,Twitter,"This comment shows a deep misunderstanding of poverty and displacement. In refugee camps in the Congo, teaching kids basic craftsmanship isn’t “enslavement.” It’s dignity and survival when a country has been devastated by 30 years of war. Children learning to make sandals so their peers can walk barefoot IS community resilience, not exploitation.",,,,
484,YouTube,in description he said,,,,
3057,YouTube,Bro learned a lesson : Use Microsoft Bing and summarize what it says 💀💀,,,,
24693,YouTube,But its all artificial,,,,
27811,YouTube,The explanation was simple and effective.,,,,
7746,Twitter,"Empowering North Karnataka through education. The Faculty Enablement Program, powered by Infosys Springboard, brought together 80+ professors in Hubballi to explore emerging technologies, AI, GenAI, design thinking, and essential interpersonal skills. https://t.co/sEqW13xwyj",,,,
5450,YouTube,please reference thus video in the apa 7th edition format,,,,
13318,YouTube,"I also would like to make a living writing, but I think ""creatives"" get a little too snotty thinking they're too good to be plumbers. A lot of the greats had to do other work to make ends meet, sometimes for their entire lives.",,,,
15914,Twitter,@heckin_gizmo @MoziasTheFish @TheMG3D It's fair use after all its educational because a machine learning system had to learn it. Oh no fair use was used against you such a shame.,,,,
15774,YouTube,"Incredible, this changed my life",,,,
7005,YouTube,Nothing new to you,,,,
28333,YouTube,If you’re incapable of writing an essay you’re cooked bro. Go back to preschool and start all over again. You’re literally going to be flipping burgers for the rest of your life until that gets replaced by AI too 💀,,,,
13142,YouTube,"Also note that AI is a heuristic algorithm, i.e., there's no guarantee that every AI teaches you or answers is 100% correct. You have to learn critical thinking skills to verify answers given by AI. You can not learn that skill from AI.",,,,
1922,Quora,"I'm not sure A.I.s are capable of lying, as that implies understanding the difference between something true and something false, as opposed to understanding that something statistically is likely to appear next to a particular word in a particular sentence or whether it's statistically unlikely to appear next to a word in a particular sentence. When it comes to hallucinations though, boy can AI hallucinate! Frequent examples are when I have students write literary analysis papers. First, ChatGPT makes up all kinds of crazy page numbers and chapter numbers or names that don't exist. I've had students submit AI-generated papers in which the AI confidently asserts that the hero Grettir in Grettir's Saga was born with a birthmark in the shape of a dragon, indicating he is fated for heroic deeds, and quickly saves the village from a dragon attack. The AI claims this happened in Chapter Two, page 18 of the Jesse Byock translation of Grettir's Saga, as assigned to the class. In actually, Grettir isn't even born until Chapter Thirteen. Page 18 is still in the ""notes about the translation"" part of the book. In Chapter Two, Grettir's grandparents are first marrying and settling down. And Grettir doesn't have any birthmarks. And Grettir doesn't ever fight any dragons. And Grettir doesn't save any villages during his childhood, merely tortures a bunch of animals, fights with his dad, and pines for heroic deeds. So, in the space of an opening paragraph, the AI lies (i.e., hallucinates) in at least five ways. I'm not sure it's really ""getting"" the AI to lie though. The AI does it all on its own, without any additional prompting beyond asking it to write an essay about Grettir's childhood in the Jesse Byock translation of Grettir's Saga.",,,,
5395,YouTube,Best I have ever found on youtube till now on this topic👏🏻Clear and Precise👍🏻,,,,
12419,YouTube,it is charged a lot of money to use it,,,,
71,Twitter,Legal Advocacy Group Raises Concern About AI Use in Federal Student Aid https://t.co/eAQp09JTxb https://t.co/f9OeINgpP7,,,,
12794,YouTube,Ai is genius! Also AI: 5+5 is 25.,,,,
8691,Quora,This seems like an excellent use of AI because the data it is presented with is of a very high standard; I think this is the key element. I think AI is more challenged when the data available is of poor quality and the problems are not well bounded. Of course I may be wrong.,,,,
25693,Quora,"I could make a career out of correcting the misconceptions about Ai on this fkin site. No, no it does NOT. There is NO computer program that understand meaning. It does NOT EXIST. As someone who authors machine learning models I don't know how this class of models work but I'm damn sure none of them understand meaning.",,,,
25728,YouTube,I host local LLMs in my house for my kids and I configured the system prompt in OpenWebUI to balance providing answers and utilize Socratic reasoning. It now acts like a tutor. I spent a lot of time tuning the prompt to help encourage curiosity.,,,,
14910,YouTube,How did they do that? Please help!,,,,
9348,YouTube,"Actually not so much anymore, I prefer them both equally",,,,
13862,YouTube,ChatGPT helps me come up with logical models in record speed,,,,
