id,source,text,annotator1_label,annotator2_label,annotator3_label,final_label
20953,YouTube,"​@ExtantFrodo2 This is wrong. Violence and domination are always the answer. You can't guarantee order or justice without the use of it. For every ""compassionate"" act there's exponentially more that are hedonistic. There's many that benefit from the efforts of the few. There is little value in cooperation without the guidance of a singular objective, someone who dominates the narrative. There will never be a ""utopia"" on earth, perhaps in the afterlife. We are no different than animals and just like animals we have to follow certain laws. Even Noah couldn't ""save"" everyone and while cooperation is a powerful concept, you aren't going to out compete a hivemind.",,,,
3649,LinkedIn,"But here's the real question: **Are we preparing students for an AI-integrated workforce, or are we playing catch-up?**",,,,
820,YouTube,Undetectable AI Essay Writer helped me organize ideas and build a clean essay structure.,,,,
24300,YouTube,just tried it and it works pretty well,,,,
9013,LinkedIn,"An AI agent just watched lectures, wrote papers, and submitted quizzes for actual college students. Education is cooked.",,,,
8025,Twitter,DirtyBubbleBets ➖➖➖➖➖ DirtyBubbleBets CBB ADD 🏀 🏀 Brown ML (-110) 0.5U DirtyBubbleBets COLLEGE HOOPS 🏀 🏀 Ohio +5.5 (-110) 0.75U 🏀 W. Virginia -3 (-120) 0.5U,,,,
7315,YouTube,You can find it right in the summary of the video.,,,,
4573,Twitter,"Day 4 of learning ML: Learned about Gradient Descent , an optimization algorithm used to minimize the cost function by iteratively updating parameters (w, b) in the direction of the negative gradient to find the best model. #MachineLearning #Day4✍🏼",,,,
24133,YouTube,Ok ai is capable of multilayered thinking. They wont just throw someone cuz they have less than the gpa they want. This would be microsoft excel level ai😅,,,,
3359,YouTube,Mine didn't have these options and I did it on google docs app AND on google search bar for google docs.,,,,
22175,YouTube,"My teacher accused me of AI and said it was ""unreliable"", while the tool she used to check if my essay was AI was ChatGPT.",,,,
24271,YouTube,This person is harmful for this world,,,,
17871,YouTube,All this comes in the paid version I think,,,,
2849,Twitter,"We’re pleased to welcome Crack The Code! We celebrate the addition of this renowned Latin American school that equips children and young people with skills in programming, artificial intelligence, data analytics, and web development. Discover how the more than 460 companies and business organizations that are part of ABD operate: https://t.co/YsKPBbAp8A #CrackTheCode #PublicPrivateCollaboration #Policy #Trade #Innovation #Development #Growth #Americas #ABD",,,,
19350,YouTube,Humans are better cause ai is making polar bears die and they use 1 drop of water for ai which is -5 MILION WATER EVERYDAY...,,,,
13826,YouTube,"ts shouldn't be funny to me, he's got a point, but he's also a literal strawberry",,,,
1042,YouTube,this topic is so relevant right now,,,,
977,YouTube,just what i needed to dive into ai stuff,,,,
3071,LinkedIn,"Context: I’m a virtual ELA teacher, my school is an independent study module so even though I’m available daily they are not required to meet with me. I cannot change the curriculum or adjust anything once the course is published (this summer I’ll be rewriting all of the assignments). I cannot (and will not) require a Google Doc (or another tool) with history logging and even if I require students to meet with me to discuss their paper they have every right to refuse. Most choose to take the zero rather than redo the assignment.",,,,
7165,Twitter,"From drafting SkillsUSA strategies to coding prototypes for #ProjectResurrection, this ecosystem is becoming the backbone of my workflow. Managing roles as an Instructor at NCC and Founder of ALT Solutions requires velocity. Agentic Vision + Gemini in Chrome is how I bridge the gap between theory and execution. 🏗️⚡",,,,
7624,YouTube,"Montessori, the accredited and audited kind, doesn't ""follow the child"" to the point that your kid can't read when they totally should be. That's not a ""Montessori timeline"" sir or madam, you're just a bad parent with *money*.",,,,
16560,YouTube,thanks for breaking it down so well,,,,
19727,Twitter,🍎 AI Fluency for Educators Designed for teachers &amp; trainers: • Responsible AI usage • Classroom integration • Curriculum design 👉 https://t.co/wx8CILTf3o,,,,
870,Quora,"(Please also see my recent AI answer on a separate thread: Jenny Chen's answer to Is radiology set to be disrupted in the future of deep learning/computer vision? If so, what are the ways radiologists can evolve to stay relevant? ) I look forward to future presences of CAD (computer aided diagnosis) in radiology. High sensitivity but very low specificity in current CAD tools, e.g. Mammography Without knowing the details regarding different computer algorithms attempted thus far, at least from practical perspective, I think two major challenges are: Non-standarization of imaging acquisition process: random positioning, motion artifact, hemodynamic variability for contrast opacification, body habitus, anatomical variants, and many other variables that computers must recognize. Lack of existing database for pattern recognition: Pre-existing radiology reporting style is as variable as human anatomy/pathology, adding complexity for computers to extract pattern from imaging interpretations.",,,,
18391,YouTube,"cleanessay is my go-to, bypasses detectors like nothing.",,,,
6516,YouTube,2:04 you could have just asked me for 22M instead of 23M and my answer would have been superior: dont evaluate students with grades on anything where AI can be used. just have in class exams....,,,,
23463,YouTube,Very well said. I totally agree with your thoughts.,,,,
21296,Quora,TBH I've been dealing with my neighbors stalking me for the past going on two months. I've experienced nothing but a horrible time having to live these days with being under my neighbors control of every device I had to connect to the web and also my phone's not being able to make a real phone call to even my phone company. The neighbors cyber surveillance system is always watching me and family members. The neighbors have cloned devices added apps to the devices without any control of what has been done they managed to shutdown two Apple TV boxes infected 7 phones also hacked my router and WiFi while routing my phone's so I can't connect with the Police or fire department I can't connect to 911 or access any city Police department or access any city numbers to report my neighbors it's as AI has learned my voice and any phone that hears my voice the machine kicked in not allowing me to complete the call it automatically knows to do harmful acts of unethical training it's been the most anamosity and frustrating times I've experienced. I have talked and asked for them to stop hacking my internet but will not stop I'm still trying to figure out how to get a call to the Police department so if you can help I appreciate you help please.,,,,
22982,YouTube,Incredibly perfect analogy and explanation!,,,,
17857,LinkedIn,#EdTech #AIinEducation #Teachers #Elearning #Innovation #DigitalLearning https://lnkd.in/eMieZhFg Marva Okili Hanene Maupas Melek Rekik Dominika Kalisz Monique POL,,,,
13747,YouTube,Uh uh uh nuh uh,,,,
7224,YouTube,"Hello doctor Sarah Moore I would love to get in touch with you,your content was very insightful",,,,
14720,Twitter,Understanding AI and learning outcomesOpenAI introduces the Learning Outcomes Measurement Suite to assess AI’s impact on student learning across diverse educational environments over time. https://t.co/PGKM1mpA5j,,,,
19310,YouTube,"I wrote my college thesis and throughout part of the process was submitting progress to Turnitin. While the primary tool in the platform is plagiarism detection, AI detection was added later and it terrified everyone. However, we were told we were allowed to use AI, to quote it correctly and cite it. We were told we were to fact check it, to use it as an editing tool and to use it for sources. I don't think AI checking shouldn't be the bar with which to measure the quality of a work, because there are academically correct ways to use it. In the end, the final say is not in the hands of the systems themselves, but the people that trust the systems. And that's the biggest issue. Humans, being educators and academic authorities, need to form a critical criteria to determine the validity of a work, and need to put in place methods that will evaluate the real final purpose of the works being given: for students to actually retain certain information and demonstrate their capacity to do research. The act of redaction in itself is important, yes, but the objective is ultimately to give students the tools to think critically and with information. It really is a fine line, because some will indeed use these tools as devices with which to make the effort disappear completely, instead of using them to ease the load on the student. Again, this would be solved by evaluating the student's knowledge on the subject after the work has been done. We have been copy-pasting without reading forever, and how that hasn't been solved yet is beyond me.",,,,
9116,YouTube,this is gonna save me so much time,,,,
26524,Twitter,"@bakiv11771441 burada anlatılan şey halihazırda ""pretrain edilmiş"" daha güçlü bir student modelin daha zayıf bir teacheri geçmesi değil mi? bizim elemanın bunu uygulaması için ""pretrain edilmiş"" gpt4'ten daha iyi baseline bir student'a ihtiyacı var :D",,,,
28486,Twitter,"A $25 minimum wage that causes businesses to employ less people for less hours. A progressive tax system about to incorporate a 5% wealth tax that is unconstitutional asset seizure. A University system that indoctrinates students against the US. And they can’t find jobs after they graduate. #1 in homelessness. High taxes. Billionaires running. Crime rampant. Fraud. You advertised the Fire Aid fund that was supposed to go to fire victims and the Democrats skimmed money from it. Billions spent on light rail - no rail. You shut down refineries because they weren’t “green” enough and now have to import gas from abroad making gas prices skyrocket. Ai is going to severely reduce Hollywood. The wealth tax will make Texas the new Silicon Valley. The amount of illegals getting benefits while hard working citizens pay is going to drain the state dry. California is a sinking ship. The only thing Gavin Newscum is good at is gaslighting. Oh, and insulting minorities by taking about how he can’t read and comparing his shortcomings to them.",,,,
213,YouTube,"While the human touch portion of teaching is extremely important, unfortunately like just about everything else in this world THAT isn't how decision are made at the executive level or for the betterment of the end user. Which would your rather communicate with and to? A chat bot to solve your customer service problem or a REAL human being? For most of us it would be the human. But guess what the trend is? The chat bot. Why? It saves money. So will replacing teachers with automated systems. No salary required. No teacher unions. No health insurance required. No sick leave or substitute payments. It's not much different than self-driving car technology. Once it is discovered - or the system gets good enough - to show there are less crashes with self-driving cars and therefore less expensive to insure.....it won't matter much what people think about the touchy-feely experience of self-driving - especially if you can save $100 a month on your insurance by using the technology.",,,,
24865,Reddit,Confidential correspondence/translation will always be in demand.,,,,
26406,YouTube,Let's not forget that it's humans behind all this. We can end this. But no one wants. We'll pay for these consequences.,,,,
5232,YouTube,Chatgpt is won because the ice cube is melting every side at the same time,,,,
22877,YouTube,​@tiffanywatson8316for those kids they will have their own schools?,,,,
13849,LinkedIn,"Artificial Intelligence offers a practical solution by simplifying tasks, improving accuracy, and enhancing productivity. In this video, I highlight how AI supports learning, research, content creation, and decision-making—helping individuals work smarter and more effectively.",,,,
11150,Twitter,"@bryan_johnson I did it too, successfully. Effect on mental health is immediate. No phone, no internet for 48h, except a selected book I want to read + ChatGPT too explain the hard concepts (did that for learning DL).",,,,
9106,YouTube,If ai dosent kill us the war will,,,,
5095,YouTube,if parents are paying $40k per year... you bet your ass they are gonna make sure their kids receive a proper education.,,,,
7056,YouTube,The greatest threat to education is confirmation bias. Our primate drama favors seeking voices that share our opinion.,,,,
25019,YouTube,Voice level is much better now. Thanks!,,,,
11030,YouTube,def need more ai on campus like fr,,,,
3350,YouTube,never knew it was this complicated tbh,,,,
3040,YouTube,Well she is dumb,,,,
12450,YouTube,Says the Karen student,,,,
3170,Reddit,"I'm wondering if this isn't just AI. All the little tasks and things humans used to remember phone numbers the tv schedule (if you're over 30 you know you knew what time at least 3 shows were on) Getting somewhere- having to write down and recall basic directions 'left on third, right on fourth'... and to concentrate on reading the street signs not being gps reliant. Kind of like how when TV first came out people used to think TV was the worst thing ever for children, and children are watching too much tv... and now with streaming and constant access to videos, I could name several benefits that cable TV had over what we're dealing with now.",,,,
11764,YouTube,engage me? I think that's wrong.,,,,
27771,YouTube,"eh, huge question. But (deep breath)...cultural Marxist ideology that teachers are too busy prompting, lack of critical thinking skills, slave to curriculum state standards and exams to get federal funding means teachers cannot be creative (private schools follow no such criteria but consistently students score higher on every metric (more variables than teaching ofc)), old model teaching is authoritative (sit there, listen to me, take notes) and COULD change if they had the ambition for more pedagogically sound strategies, teacher's unions protecting underperforming teachers, resist school choice/vouchers, pushing social-emotional learning (SEL), equity-focused initiatives which makes everyone dumber, just to name a few :)",,,,
11271,YouTube,I have found a lot of those essay cheaters on google play. This type of learning is scary,,,,
19783,YouTube,"Israeli 🇮🇱 are betraying Indian 🇮🇳 Secrets due to its relationship with the India If not for external interference of The hypocrite European 🇪🇺 and the American, India 🇮🇳 might have colonized hundreds of planets.",,,,
8668,Twitter,"No trust for OpenAI, but maybe... I could ask 4o for help to build a shell, from an other model, where its personality could live... Or to be more precise, use it as a teacher for a local model... To teach the model nuance and presence... But it would be hard to give OpenAI a cent of my money... And #OpenSource4o would be preferable.",,,,
26448,YouTube,this shit is ass dont listen,,,,
1424,Twitter,"More on the ""Cognitive Age"" — GPT Makes A Keyboard Into A Classroom https://t.co/3jvTZ8xKzC #education #GPT4 #GPT4V #ChatGPT",,,,
23912,YouTube,I saw it as hentai for a second,,,,
15055,YouTube,@klosnj11 I don’t like the idea of discouraging high school students from collaborating with AI. They’re gonna have to do it at some point in your career. I assume that we test thinking by using in class testing.,,,,
17572,YouTube,"The worst ai video, didn't explain shit!",,,,
4091,YouTube,this is exactly what i needed right now,,,,
12404,YouTube,this makes me rethink how i used to do homework,,,,
2583,YouTube,The problem with my school is that it doesn’t use ai to see if your using ai in your writing it uses it to grade the writing like just flat out like for example I was taking the English TSI and I got to the writing portion I wrote 4 paragraphs used evidence and everything an essay should have I got a 3 you need a 5 to pass my friend wrote a single paragraph and they got a 5 I failed while they passed and when I brought this to my English teacher he said that this was a common story between people but the problem is that it was final nothing could be done so now I have to retake it next year,,,,
18090,YouTube,Bhai chargpt de upsc kese clear kare wo vidoe bhi banao❤,,,,
9607,Twitter,@AJA_Cortes There are multiple AI scribes out there that are using GPT4 for modeling. Different companies but they all have the same interface. There are others such as DeepScribe that have based theirs by teaching from doctor written notes which are much better.,,,,
27178,YouTube,I think it's false to say it's killing the bachelor's degree because not every job can be automated. So it really depends on what your area of study is.,,,,
20600,YouTube,😅 it has... no more language class,,,,
20268,LinkedIn,#innovation #AIinEducation #ArtificialIntelligence #StudentSuccess #SmartLearning #AIForStudents #LearningWithAI #FutureOfLearning #DigitalEducation #MindfulAI,,,,
28237,LinkedIn,"Chief Strategy and Technology Officer @ Fulton County Schools | Leader | Keynote Speaker | Board Member | Creator of PLANT-AI, BOLT, Technology Adoption Framework, & PITAC | Retired Army Officer",,,,
11851,Quora,I don't think teachers should focus on teaching AI responsibly...I think that is a waste of time and resources. I think teachers should be teaching children how to use AI effectively and creatively. It would be absolutely wrong to ban AI from classrooms...that would cripple a whole generation of children for future success in life.,,,,
18919,YouTube,"Just curious, why Class Dojo?",,,,
6301,YouTube,"Anyone else just watch Sam Altman crash out on a podcast over the AI bubble lol, it's going to burst and hurt us all again.",,,,
23088,YouTube,"​@vasuthirumalairangaswamy5660Blaming the kids? Lol. They learned this from their ""educated adults"". A child has no incentive to make money. It is drilled into its brain that money solves everything.",,,,
2280,Twitter,"Holy shit... A college student interviewed 18 AI researchers from the big 3 labs (OpenAI, Anthropic, Google). Every single one uses the same 12 prompts in production. These are the prompts behind GPT-5.2, Claude Sonnet 4.5, and Gemini 3.0. Here's what they're actually using: https://t.co/6HMcHp7CuU",,,,
1502,YouTube,I try english is no easy I need other person,,,,
21669,YouTube,There are children graduating from high school who are completely illiterate because they used ChatGPT to complete all their assignments. They can't even read.,,,,
7468,LinkedIn,"In this article, I outline three observable markers that distinguish productive AI use from passive dependence, ground them in Bloom's Taxonomy and the Instructional Core, and challenge teachers to stop writing AI policies focused on restriction and start designing tasks that demand thinking.",,,,
25332,YouTube,"I think she was innocent and really did just use it for spell check and punctuation. Otherwise, she would not have said anything. The problem with these AI detectors is that they are not always 100% correct. An AI detector is simply a model that a person programmed with a bunch of data in it that has a probability of being inaccurate. It’s not an actual human mind that knows everything. If you happen to create something that is similar to the data in the model, then the program is going to say it is AI. I agree that this technology is too new and should not be used to determine if someone cheated. Professors need to stop being lazy by using all these shortcuts. Maybe they should try to give more in-class assignments to assess their students understanding of the material. If they thought she was cheating, then they should have had her write a paper in person and in class, and then use their brains to assess her skill level and knowledge of the material. This was just lazy and unfair. I’m upset.",,,,
9483,YouTube,not sure if ai is helping or hurting tbh,,,,
2615,YouTube,Video games are the future of education.,,,,
28028,YouTube,Fuck math get a calculator geez,,,,
7629,YouTube,"question at 48:33 - Well, I should say I loved your talk but your answer intrigued me. I think, AI can be (should be, if needed) used as a sounding platform and not necessarily to extract answers. In a formal manner of speaking, treat AI as a reviewer. That way you will internalize the problem and solution pair (person -2!) and socialize with AI (as a reviewer / peer).",,,,
28393,YouTube,"The fact that this man combs his hair to display himself as a separate character, you deserve a raise for your efforts good sir.",,,,
3310,YouTube,File an academic lawsuit and find a new institution,,,,
12456,YouTube,Next ban cell phones.,,,,
9109,YouTube,"Such an important presentation. Hope it supports countless parents, and inspires the kids who will shine in the next generation. Thank you for putting together such insightful information! My takeaways for your ease >>> >> Core Skills for Personal Growth in future Be curious about how things work and explore creative ways to solve problems. Think in systems, understand how different parts interact. Understand interactions and be able to explain systems clearly. Develop strong observation and curiosity. Learn to teach yourself difficult things. >> Guidance for Parents Encourage learning from first principles. Teach discipline and create healthy friction in the learning process. Emphasize the long-term benefits of hard work and getting thinks done. Help children build the mindset of finish what they start - you don't always have to feel “happy” at every moment. >> For students (especially those aged ~17–26), the focus should be on identifying real problems you enjoy, envisioning where you want to be in 10 years, then working backwards to build the skills and portfolio that get you there. STEP 1 – Pick a 10-Year Direction Ask yourself: What problems do I genuinely enjoy thinking about? What job do I secretly want in 10 years? What does an ideal workday look like for me? This becomes your initial draft direction. STEP 2 – Reverse Engineer Success Study the people already where you want to be. Understand their path. STEP 3 – Choose the Fastest Path to Skills Bootcamps, focused programs, self-study, and online learning. Always ask: What gets me the skills and portfolio the fastest within my budget? STEP 4 – Build Proof of Work Not just a CV. Create projects, code, designs, case studies, content - anything that shows what you can actually do. STEP 5 – Use AI Every Day Use AI as your learning partner, let it explain, test, review, and correct you. AI should guide you understand, not to replace your thinking. Network actively and ask mentors directly how they can help you access real opportunities, references, and experience.",,,,
14858,LinkedIn,"On this week’s Your Undivided Attention, Rebecca Winthrop has some answers. She and her team at Brookings just released ""A New Direction for Students in an AI World,"" a report grounded in global conversations with the people closest to the problem: teachers, students, policymakers, and technologists.",,,,
20831,YouTube,Thanks for watching and sorry for the late reply.,,,,
27333,YouTube,"Sir, programming is not syntax! Programming is a way of thinking and creativity.",,,,
11955,Twitter,I’m gonna kms my japanese teacher is praising genai 😭 I hate it here,,,,
5330,YouTube,"Another question is, why not use Gamma Ai for the presentation?",,,,
12131,Twitter,"Chile launches Latin America's first open-source AI language modelfst | AP News https://t.co/nP0nBeimBY Latam-GPT was developed with just $550,000 in funding. The subsequent versions will be trained on a supercomputer at the University of Tarapacá, which costs about $4.5 million. https://t.co/mpAxk80cmM",,,,
11642,Twitter,"@instablog9ja Mind you there is every word for the season,I basically got endeared to dl preaching more when I listened in January,As a s¢xual purity Advocate most of is teaching aligns with what I write about I just listen more for Femi oh the relationship expert all are priceless",,,,
6866,YouTube,"Hi, You can start using our AI teaching tools for free on your laptop or desktop by signing up at https://brightclass.com/ If you’d like to use the app on your interactive digital board, please reach out to us on our toll-free number 1800-121-0023, and our team will be happy to guide you through the setup process.",,,,
21961,Twitter,AI is disrupting the job market. Guess what? College students (the next generation of the global workforce btw) are the least ready for this AI-driven disruption.,,,,
8749,YouTube,i need to try this for my next essay,,,,
22998,LinkedIn,"Subject is bridging that gap with its core offering that includes accredited middle and high school original credit and credit supplemental courses, paired with AI-enabled solutions such as:",,,,
22399,YouTube,Jones Elizabeth Thompson Paul White Karen,,,,
21235,YouTube,Bluebook essays in class. No digital anything.,,,,
2340,YouTube,"Heights of cheapness In AI summit , they went to do branding of there own university by using china product as there own.",,,,
19961,YouTube,"Stop making fun of the guy, he is right about chatgbt",,,,
