id,source,text,annotator1_label,annotator2_label,annotator3_label,final_label
306,Quora,"The Felony in the Backpack: Why Your Child Should Never Unlock Their Phone at School (And, yes - It is Illegal for Schools to Rifle Through a Student's Cellphone) I was recently going through my Quora queue and stumbled on a very interesting question asking about parent and student rights regarding confiscated student property. Because of the intersection of innumerable legal issues surrounding property confiscation and criminal law, I felt it appropriate to provide a robust analysis. And, to top it all off, I can't find the original question any longer because I didn't save the draft properly—oops. But the topic is too important to let slide. After the various school violence tragedies we have all been forced to witness, we all understand that kids need to be safe at school. Fearing death throughout the day is not conducive to learning. But in American society, the rights of the people remain paramount. For decades, the Supreme Court has been forced to walk a tightrope between these competing interests, and the result is a legal landscape that every parent needs to understand before they send their child off to homeroom. The Supreme Court famously held in *Tinker v. Des Moines* that students do not ""shed their constitutional rights... at the schoolhouse gate."" There is no iron curtain separating the Constitution from the classroom, and parents should never feel ashamed to ensure their children know it. However, while the Constitution enters the building with the student, it changes form once inside. The courts have essentially decided that the school environment is a unique legal ecosystem where the rules of the street do not apply. This is most evident in how schools handle your child's property. In the outside world, the police generally need ""Probable Cause"" and a warrant to rifle through your belongings. Inside the school, under the precedent set by *New Jersey v. T.L.O.*, administrators need only ""Reasonable Suspicion."" This is a significantly lower bar. It means that if a teacher sees your child acting nervously near a locker, or receives a credible tip from another student, they often have enough legal cover to open that locker without your permission—and without a warrant. In this regard, the comparison to a correctional facility is not entirely hyperbole. Courts have generally held that students have a very low expectation of privacy regarding school lockers, viewing them as school property ""loaned"" to the student and subject to inspection at any time. The backpack is different. It is personal property and theoretically requires ""individualized reasonable suspicion"" to search. They cannot just search every bag in the classroom because a phone is missing; they need a reason to suspect your child specifically. However, we must be realistic about how this plays out in a hallway or a vice principal's office. Suspicion is rarely articulated clearly in the heat of the moment. Instead, it is often reconstructed months later, after lawyers have gotten involved. An administrator who searches a bag on a hunch and finds nothing simply sends the student back to class, and no one is the wiser. But if they find something, they will almost certainly recall—after the fact—that the student ""looked nervous"" or ""smelled like weed,"" creating the legal cover they need to justify the intrusion retroactively. The danger here is that students are socialized to obey teachers, so they often give consent to a search when they don't have to. Students must understand that the moment a teacher's questions shift from normal school stuff—""Did you do your homework?"" or ""Where is your permission slip?""—to criminal investigation—""Who were you with at lunch?"" or ""Why do you like guns?""—that teacher is no longer an educator. In that moment, they are to be viewed as a police officer. Consenting to a backpack search in that scenario is no different than inviting a detective to rummage through your car. This concept extends to the most dangerous item in your child's possession: the ""21st-century backpack,"" otherwise known as the smartphone. A cell phone is not just a container; it is a digital archive of the child's, and possibly even yours, entire life. While the Supreme Court (*Riley v. California*) has ruled that police generally need a warrant to search a phone, schools often ignore this boundary under the guise of ""consent"" (and frankly, teachers are rarely trained in constitutional rights anyway). They may confiscate a phone for a simple rule violation, like texting in class, and then use that as an excuse to browse through private photos and messages. This is where parents need to get real about what is actually on those phones. In today's world, teens ""sext."" They trade explicit pictures and test out adult conversations. Most parents view this as ""experimenting"" or a moral failing but don't necessarily see it as a crime. But the federal government views it as the production of child pornography, which carries a 15-year minimum prison sentence. Many parents assume their children are protected by free speech or ""Romeo and Juliet"" laws, but in *United States v. Streett*, Judge James O. Browning ruled that minors do not have a First Amendment right to sext and there is no Romeo and Juliet law for digital crimes. He held that federal laws prohibiting child pornography apply even to consensual texts between teenagers. This means if a school administrator bullies your child into unlocking their phone and finds sexting images, your child isn't just facing suspension. They could be facing a felony and lifetime registration as a sex offender. Nothing illustrates the danger of interacting with school officials once they have latched on to a criminal inquiry better than the tragic case of the Oxford High School shooting and the conviction of the shooter's parents, James and Jennifer Crumbley. Parents often ask if the Crumbleys ""cooperated"" with the school. The answer is yes—and that is exactly what helped convict them. On the morning of the shooting, they were called to the school because a teacher found a disturbing ""sketch"" on their son's math worksheet featuring a gun and a plea for help. The parents came to the school, met with counselors, and looked at the sketch. But because they viewed the meeting as a nuisance rather than a critical legal confrontation, they made fatal mistakes. They told the school they couldn't take their son home because they had to return to work, and they did not demand to search his backpack—which was sitting right there in the room, containing the handgun. The school administrators, covering their own liability, later testified against the parents, stating they were ""caught off guard"" by the parents' refusal to act. The school used the parents' presence and their specific statements in that meeting to build the narrative of ""Gross Involuntary Manslaughter."" Had the Crumbleys treated that meeting as an adversarial encounter—had they brought a lawyer or simply refused to speak until they understood the legal jeopardy—a lawyer would have likely demanded the bag be searched or the child be removed immediately. Instead, the parents walked into a trap where the school documented their negligence to save itself. I want to be clear before we go further: I am not implying that your kid is a criminal or engages in felonious behavior. In the world of criminal defense, we don't care what is actually on the phone or in the backpack. Our goal is to protect the right to keep it private. The old adage that ""if you have nothing to hide, you have nothing to fear"" is a dangerous fallacy. The government routinely twists innocent behavior to make it appear criminal. Consider the case of Richard Jewell, the security guard who saved lives at the 1996 Olympics. The FBI took his zealousness for his job and twisted it to fit a bomber profile. Innocent behavior became ""evidence"" of guilt. That is why privacy matters, regardless of innocence. To protect themselves from this trap, a child must first learn to recognize when a conversation has shifted from academic to investigatory. An academic question is safe: ""Did you finish your essay?"" But parents must teach their children to hear the alarm bells when the questions pivot to their behavior, their peers, or their property. Questions like ""Whose bag is this?"" or ""Do you know anything about what happened in the bathroom?"" are not educational inquiries; they are interrogations. Once that line is crossed, the burden of protection falls on the student. You must train your child to view school administrators in that moment not as ""educators,"" but as government agents. The instruction to the child should be absolute: never speak the password, and never unlock the device. It does not matter if the request comes from a favorite teacher or the principal. The device is a vault, and the student holds the only key. If the school believes they have the legal authority to search the phone, they can attempt to bypass the encryption themselves or seek a warrant. By refusing to unlock it, the student is not being insubordinate; they are forcing the government to follow the law. School officials rely on the student's instinct to please adults. They will use the ""Friendly Traitor"" tactic, telling the student that if they just tell the truth, the school can help them. The reality is that once a student admits to a crime—whether it's drugs, weapons, or sexting—the administrator is often required by law to hand that info to the police. Parents must teach their children a simple script: ""I will not answer any questions without my parents present."" Finally, you must have a plan for when the school inevitably takes something. I recall a situation when I was in 8th grade where a friend was arrested and adjudicated delinquent because he accidentally brought a box cutter from his construction job to school. The teacher didn't see a hardworking kid; she saw a ""weapon"" and a Zero Tolerance violation. This is why immediate communication is vital. If anything is confiscated, your child should tell you immediately. If the item is perceptually dangerous or could have deeply personal secrets contained in it (like a cell phone), assume the worst. Do not try to talk to the school to ""clear things up."" Get a buffer between you and the government and call a lawyer. If the school has your child's phone, assume they are trying to break into it and presume that anything they find ""can and will be used against"" them. Ultimately, we must remember that public school teachers are not just educators; they are government officials bound by the Constitution just like the police. While the courts have granted them significant legal leeway to maintain order, that power is not absolute. Do yourself and your child a favor: teach them how to invoke their right to not open phones, and if anything is taken from them, demand its return. And if you really want to protect yourself, bring a lawyer if you are ever called to a meeting with school officials that could turn into an analysis of your child's ""behavior."" Protecting your child means understanding that in the eyes of the law, the principal's office can be just as dangerous as the precinct. Image Credit: Gemini - People and Places are fictitious",,,,
15018,YouTube,You have slick videos! I teach ChatGPT/Gemini/Firefly https://youtu.be/_Ekm0XL1wR8?si=ML7-gF8gFlt1OWiR,,,,
20355,Twitter,"@StephenLindsey @Poopoostinkiyu1 @myjumpshotass @CultureCrave @AP It is quite literally different. This is deepfake technology which is not the same kind of machine learning at all. Obviously generative AI is able to do this too, but this is objectively not that at all.",,,,
18449,Twitter,"IIT Kharagpur Alumnus Donates $5 Million An IIT Kharagpur alumnus has pledged $5 million to establish a new School of Digital Engineering focused on AI, machine learning and digital technologies to strengthen research and innovation. https://t.co/D23M2g6Ymc https://t.co/z7b4T1xwiC",,,,
3277,YouTube,Is 0% even possible????,,,,
2401,YouTube,Iska koi app h ya direct google se open ho jata h,,,,
17618,YouTube,the art style and animations here are so mesmerizing,,,,
6985,Twitter,"@_AK1089_ @profavi_ Being a poor and unemployed student, I only pay $20/month to each company, but if you mean the $200/month plan I hear pretty good things about GPT-5.2 Pro. Since I don’t get that, I just take my limited Opus 4.6 tokens as that’s the comparably smart model.",,,,
16577,YouTube,THIS TOOL? Why won't u name it ?,,,,
4341,YouTube,Trained equals steals,,,,
11437,YouTube,He's correct tho u prolly got 7 IQ at max,,,,
2255,Twitter,"Perplexity AI on the Beginning of the Universe Perplexity AI is a popular Large Language Model (LLM). It has both a free version and a paid Pro version. For this discussion, I used the free version in Academic mode. Academic Perplexity is very similar to Scholar GPT, which is https://t.co/gjiARkHlKH",,,,
8005,YouTube,How do i get your books? I am in Nigeria.,,,,
12109,YouTube,"AI can personalize learning experiences for each student, tailoring content to their individual needs and pace.",,,,
9339,YouTube,CID video gane,,,,
5170,YouTube,I live in Hawai'i and most schools don't have air conditioning.,,,,
14359,YouTube,"Funny how someone who got so many people interested in physics says he doesn't know how it's done. Of course you do. Great talk. I wouldn't worry too much, education is inevitable.",,,,
27321,YouTube,"my man you need to update the video, ai has progrest, now half the things ur saying they have fixed",,,,
17801,LinkedIn,#AIED #LearningEquity #FLN #EducationPolicy #ScienceOfLearning #AIforGood #PublicPolicy #India #BehavioralChange,,,,
23054,LinkedIn,"The difference isn’t the teacher. The difference is the tools. As Salman Khan, founder of Khan Academy, once said:",,,,
9913,YouTube,The video is ai,,,,
20044,Twitter,Who has that teacher LLM that creates the curriculum from training data for downstream training of an LLM? Perhaps that's how you use a stronger system like GPT4 to train a smaller system? Isn't that what everyone is already doing?!,,,,
21430,YouTube,We created AI,,,,
17333,YouTube,nah i never used this dumb ai even tho i am a kid im cooked to my mother when i bringmy phone to school☠️,,,,
257,YouTube,When Teachers actually become Smart:,,,,
21885,LinkedIn,The INSANE results: 18 hours of AI tutoring produced learning gains equivalent to 1.5 to 2 full years of regular schooling! The cost? $48 per student ($9 for each additional student).,,,,
26775,YouTube,I want to do this but it costs money more importantly dollars and I don't live in the usa I might start a gofundme,,,,
18174,YouTube,Let me guess another paid ai for students,,,,
9811,YouTube,"Only in USA, some other countries are not advanced enough yet to replace humans Ai and I don't think they would accept the idea of replacing a person with Ai",,,,
21738,YouTube,Nano banana is very easy to use,,,,
3395,Twitter,"Won’t happen. The current US army recruits are the most overweight, unfit, low IQ in history. Only ppl who couldn’t add fractions even join military instead of going to college. This generation is more mentally stunted bc of social media, covid, and LLM.",,,,
4401,YouTube,"I see our present-day education system as an outlandishly expensive, outdated bloated dying whale. This new approach is sleek, fluid and cheap. I feel as though it should be quickly adopted as the new world education standard.",,,,
8667,Quora,"##OpenAI lists some of the limitations of ChatGPT as it currently exists in its presentation of the model. These include that ChatGPT sometimes writes coherent but incorrect statements, that it makes assumptions about ambiguous queries, and that the model tends to be excessively verbose, among similar concerns for news update go for telegram group @CRYPTOSIGNALALERT In the first weeks of its public release, ChatGPT made headlines for its alleged use among students in creating AI-written papers and assignments. Concerns about the misuse of ChatGPT for academic cheating grew large enough that a computer science student at Princeton University created an app designed to identify and expose writing created by the bot. 8",,,,
3783,YouTube,there were only 10% of people rocking up to lectures when i was in uni too and it has nothing to do with ai,,,,
3508,YouTube,"It's 2 AM, my essay is due, and it's giving major ""written by ChatGPT."" One click with Clever AI Humanizer and suddenly it's giving ""thoughtful and original."" I can finally go to sleep. 😴",,,,
24328,YouTube,Haha stupid snitch,,,,
5094,YouTube,I'm conservative and I believe that education must be a human experience.,,,,
8925,Twitter,@sumeetrm @jxmnop There’s some much to apply from traditional pedagogy to ML Great work!,,,,
9233,YouTube,"The problem with using a general, or directed, AI to teach anyone is ensuring it’s using pure data and objective truth and facts on all subjects. And I don’t think that’s anywhere near realistic, considering what ChatGPT looks like in the early stages. Its bias is clear as a bell and that’s just the one big one people know about. What’s gonna stop people hiding all kinds of their personal ideas in teaching software? Nothing, nothing at all. Who’s gonna watch the watchers?!?",,,,
19820,Quora,"AI in academia offers many benefits, but there are notable disadvantages as well: 1. **Plagiarism and Academic Integrity**: AI can generate text that may be used to bypass academic work, raising concerns about plagiarism and the authenticity of student work. 2. **Dependence on Technology**: Excessive reliance on AI tools may reduce critical thinking and problem-solving skills among students and researchers. 3. **Bias and Fairness**: AI systems can perpetuate or amplify existing biases if they're trained on biased data, affecting the fairness of academic evaluations and research outcomes. 4. **Job Displacement**: Automation of certain academic tasks could lead to job displacement for administrative staff and even researchers if AI systems take over certain roles. 5. **Privacy Concerns**: AI systems often require large amounts of data, raising issues around the privacy and security of academic data and personal information. 6. **Quality Control**: AI-generated content might lack the nuanced understanding and critical analysis expected in academic work, potentially affecting the quality of research and publications.",,,,
6902,YouTube,Bravo. A good take.,,,,
23515,YouTube,"I mean, who are we to argue with GROK in this particular instance? I think it's correct Thanks for the videos! <3",,,,
11236,Twitter,"Your enlish teacher is feeding all of your papers into software run by genAI that purports to detect AI written works The problem: like most genAI, it doesn’t actually work 🙃 #QuitAI #UnplugAI",,,,
6672,YouTube,"the more you know, the more you can leverage AI. if you're know nothing about biology, you can't use AI for biology research cuz you don't have a foundation",,,,
22528,YouTube,"You didn't even play the video SciSpace produced. Judging from the presentation slides, doesn't seem very good and generating visual content",,,,
20783,YouTube,another low quality stating the obvious vidoe,,,,
27949,Quora,"Not many, I guess. When you are a student of machine learning, the first thing you do in front of a new problem is think of how you you could put it in a shape where it can be addressed using classical machine learning techniques, and then test a lot of different techniques with simple implementations to see how they behave and compare. And simple neural networks, such as perceptrons and multilayer perceptrons, are a rather classical machine learning technique. So you can bet they have been tried in a number of situations. If they are not readily used for some specific problem that is solved by one or more other ML methods, that is probably because that (or those) alternative method(s) perform better than simple NN for that problem. However, I am quite convinced that there are many problems that are currently not solved using modern machine learning methods in general (including NNs) because they are more difficult to express as machine learning problems than most, but that would significantly benefit from being viewed under that perspective.",,,,
8651,YouTube,@ChickenStars24Ever heard of a joke or rage bait. Looks like you were not smart enough to realize….,,,,
16562,YouTube,So I’m not the only one who gets a question wrong on purpose😅,,,,
16009,YouTube,Super innovative and a great implementation of the concept✨,,,,
8229,YouTube,i want turnitin,,,,
27726,YouTube,តើអ្នកគិតថានេះជាហ្គេមទេ? អ្នកគិតថាអ្នកអាចឆ្លងកាត់ដំណាក់កាលសេដ្ឋកិច្ចដោយចម្លង និងបិទភ្ជាប់ចម្លើយ ហើយខ្ញុំមិនចាប់អារម្មណ៍ទេឬ? ទុក​ឲ្យ​ខ្ញុំ​បំបែក​វា​ចោល​ទៅ! អ្នកទាំងអស់គ្នានឹងធ្វើការនៅ MCDONALD'S! ឬអាក្រក់ជាងនេះទៅទៀត KPMG ជារៀងរហូត!,,,,
1665,YouTube,"Hi khan academy, could you tell me how to do that and share my screen so chat gpt 4o can see khan academy while using it?",,,,
3025,YouTube,Altman you're going to wreck this world.,,,,
20785,YouTube,The part about the economic implications is what people are still underestimating.,,,,
27177,YouTube,This will age poorly,,,,
9067,YouTube,"If I was a teacher here’s the assignment: Have chat gpt write up an essay on [whatever specific topic being taught], then grade it yourself and give it back to me. You can then grade how well they actually understand a topic… minus points for missing inaccuracies, must leave a cogent remarks on every paragraph, etc…",,,,
1445,YouTube,"Humans will have no knowledge, no intelligence, and no experience. If a kindergartner no longer has to learn to read or do math, which is where we are headed, then they won’t be “2 years ahead.” Future generations will be idiots.",,,,
117,YouTube,Does it just listen to the lecture or do you still have to type notes?,,,,
10930,YouTube,All people make mistakes. THE CREATOR of AI is human. What makes you believe that you are not being deceived?,,,,
25269,YouTube,Sorry we homeschooled and this does not sound much different than when the public schools try to sell a new curriculum. The developer of the curriculum makes it sound great for the kids but nothing and I mean nothing is a good substitute for hands on learning. And the current teachers have crazy benefits with steadily rising pay with guaranteed raises and 3-MONTHS OFF in the summer. Not a fan sorry!,,,,
4287,YouTube,Wow. Good thing I am a year away from retirement. My job and my entire profession will be made obsolete by AI in about three years by my estimate. The world as we know it is ending. The AI revolution is in its infancy stages now and it's already wrecking havoc on the job market; I can't even imagine the devastation that will take place once it really gets going.,,,,
20877,YouTube,I am afraid for the future,,,,
8584,YouTube,Jst unplug it,,,,
5295,YouTube,Sounds like hell,,,,
24289,YouTube,Actually I want to join for this project especially to increase the health rate of cancer patient with minimize the duration of diagnosis process,,,,
14479,YouTube,This made things very clear.,,,,
18078,YouTube,"If you use AI alter what it gives to you. But to be honest, you're a fool if you cheat at anything, because you're cheating yourself.",,,,
23124,YouTube,Awesome ideas. 👌 Muchas Gracias,,,,
14015,YouTube,"This is wrong but I guess, wrong is the new order of the day! Disgusting!",,,,
