id,source,text,annotator1_label,annotator2_label,annotator3_label,final_label
24116,YouTube,"If your architect built a neural network that produces lies then there is a flaw in the design, they must to go back adjust the weights and feedback to ensure the system doesn't produce a lie. That is, assuming you don't want your system to lie. Maybe you do so you can scare people. But I don't want a system that lies . It's a Digital computer running an algorithm that analyses and processes data for a specific purpose. It's not a monster you can't control.",,,,
5561,YouTube,Perfect app for learning during commute breaks.,,,,
21590,YouTube,Iae rpzd que não sabe inglês kkkk,,,,
2779,YouTube,You mean A1? 🤦‍♀️,,,,
9300,Quora,"One day AI may be better than teachers, but not yet. Nor do I see that happening within the next 20 or 30 years. And actually, that AI will need to be coupled with robots inside the classroom. An AI ain't gonna hand out crayons and paper, and do all the physical stuff a teacher does with the kids all by itself. I say make it 50 years before AI and robotics can replace a teacher.",,,,
16891,YouTube,Some universities don't allow students to see it,,,,
21754,LinkedIn,"Zhu, Y., Liu, Q., & Zhao, L. (2025). Exploring the impact of generative artificial intelligence on students’ learning outcomes: A meta-analysis. Education and Information Technologies, 30(11), 16211–16239. https://lnkd.in/gWeKVmpC",,,,
20741,YouTube,"didn't know these existed, thanks for sharing!",,,,
20292,YouTube,"My PhD student submitted a research paper to a journal, the review came back with a lot of questions with an emphasis on inconsistency. When asked, the student claimed to have done everything right themselves and stated that it was chatGPT's mistake. The student is convinced that Using chat GPT to deduce scientific logic was (and is) a correct thing to do. We can see what kind of scientist this practice will yield but unfortunately, we have no mechanisms to restrict this practice without considerable effort. The stress is not worth my salary.",,,,
10984,YouTube,finally a video that explains ai in schools,,,,
3061,YouTube,I am so sorry to hear that mate. Please let me know if I can help you anyway here,,,,
26819,YouTube,Bro literally believed a reddit story,,,,
24614,YouTube,Just knowing any search using AI gets the question wrong at least half the time should indicate not to use it in place of learning facts 🤦🏻,,,,
7697,YouTube,Probably private school. How much per month?,,,,
22047,YouTube,Alphas don't have to read.,,,,
10172,YouTube,I need the template please,,,,
7362,YouTube,"I mean, nobody wants to do that 20 page essay about some random crap nobody cares, the student doesn't care about it, just their grade, and the teachers also don't care about it, just want to grade and get it done with",,,,
26430,Twitter,@VTHSXC @FixingEducation We would have had half the teenage boys stepping in to help the teachers. Not every high school has gone completely off the rails!,,,,
6526,YouTube,I think u need more recognition than u have ..... U r the bestt,,,,
4829,Quora,"It matters when our view of reality is duped by AI. A History teacher reported that he did not succeed in convincing all of his students that historical photos taken in WWII, used in History books for seventy years, are legitimate. Most students were thunderstruck that these documents are actually real, because originally they were convinced that all of them were either created with AI, or at least manipulated by AI. Some students refused to believe him at all, claimed that he tried to deceive them with his ""AI lies"".",,,,
801,Twitter,"Machine Learning from First Principles ML is not magic. It is structured mathematics. 🧵 • Prediction = Function Approximation Find a function f(x) → y that works on unseen data. Not memorization. Generalization. • Data Is the Only Teacher No hand-written rules. Only examples + feedback from mistakes. • Learning = Optimization Minimize a number (loss). Lower loss → better predictions. That’s the central law of ML. • Loss Function Defines Success You must mathematically define what “good” means. If you can’t measure it, you can’t learn it. • Parameters Are the Knobs Models are functions with adjustable weights (θ). Learning = turning knobs to reduce error. • Gradient Descent = Adjustment Mechanism Compute slope → move opposite direction → repeat. Like rolling downhill on an error surface. • Generalization Is the Real Goal Zero training error is easy. Low error on unseen data is intelligence. • Bias–Variance Tradeoff Too simple → underfit. Too complex → overfit. Engineering lives in the balance. • Three Learning Modes – Supervised: learn from labeled examples – Unsupervised: discover hidden structure – Reinforcement: learn via reward signals • Overfitting Is Inevitable Without Constraints Large models can memorize noise. Regularization forces discipline. • Inductive Bias Makes Learning Possible You must assume something about the world. No assumptions → no generalization. • Deep Learning = Representation Learning Stop hand-crafting features. Let the system learn internal representations. Machine Learning is not hype. It is optimization + statistics + assumptions about reality. Execution matters. #MachineLearning #AI #FirstPrinciples #DeepLearning #DataScience #Engineering #STEM #Optimization",,,,
1515,Quora,"You have two possibilities here. You can learn programming to understand that what we call AI isn't really anywhere near intelligence. On an evolutionary scale it's the equivalent of a slime mold. You can learn marketing to understand that marketing types have fed the general public a line of bullshit 1,000 Km in length.",,,,
8024,YouTube,"@LTX-x7r ai is worse for the environment than phones. Like what, do you want me to live in the woods scavenging for acorns or something??? I didn’t even buy this phone, I got it as a birthday present in sixth grade 5 years ago. Why r u judging me 4 using a phone by commenting using a phone???? 💀💀 (And I never said I was a “big planet lover” I was just saying that that’s part of why it’s so controversial, although I think everyone is a big planet lover? No i actually hate oxygen and flowers and sunsets and life. What?😭)",,,,
15570,LinkedIn,Business Intelligence Analyst @ Binghamton University | Data Science| Higher Education| Optimization| LLMs applications| LSSGB,,,,
20031,YouTube,That's cool just figured out if you teach kids to be successful they will be successful problem solved in public schools,,,,
27845,YouTube,"I haven't tried this yet, but here is what I found. Let us know if this works!! Here’s how to use your same ChatGPT account and get verified as a K12 teacher so you can use it for free: 1. Log into the ChatGPT account you already use. Keep that tab open. This connects the verification to your current account. 2. Open a new tab and go to chatgpt.com/k12-verification. It will link the verification to the account you’re already logged into. 3. Start the verification flow. Enter your school or district email, your role, and your school info. This part is handled through SheerID. 4. Check your school email for the confirmation message. Click the link inside to finish verifying. 5. Choose your workspace. Create a new one for your district or join the one already set up for your school. 6. Complete the short teacher onboarding. Pick your role, grade levels, and subjects. 7. Confirm your upgrade. Go to Settings → My Plan and you should now see the K12 Teacher plan with all the premium features for free. Should be able to switch between your school account and personal account in the bottom left-hand corner. That’s it! You keep your same chats, same login, same everything… just with the teacher perks added. If you want, you can also invite coworkers using their school email. Hope this helps!",,,,
25182,YouTube,Yeah I tried that with a 100% senf written text and they told me i was likely be written by ai,,,,
2387,YouTube,"Fire video, nothing else to say.",,,,
14924,YouTube,All this from a chatbot? gosh!!!!,,,,
13581,Twitter,@MahmoudBarbary6 0$ Antigravity pro (student account ) Cursor pro (student account ) Two copilot pro (student account ) Preplixity pro (student account ) Gemini pro (student account ),,,,
20637,YouTube,"It's so so pathetic, because, I think there is no regulations what sort of information is pilled up as DATA , for AI to work on😮😮😮😢😢😢",,,,
18864,YouTube,@Anarkadio what is Anki?,,,,
6372,YouTube,I appreciate it very much,,,,
23539,YouTube,College is a scam always has been. Do what you need to do to get your dumb little paper that means nothing. You will learn what you need on the job like 100% of people.,,,,
22819,YouTube,That foesnt work. Chat got has taken credit for it hasnt written. Colleges had to apologize,,,,
12583,YouTube,If Grammarly adds or restructures a sentence then yes it will be detected as AI. If only punctuations and minor mistakes are corrected then it will have less chances of AI detection.,,,,
16200,YouTube,"Today marks the day I'm finally quitting any source of AI when it comes to school work or assignments. As a HS student, my GPA sits at a 3.77; however I've been getting lazy on essays and assignments that require long answers, so I'm embarrassed in myself. It makes me feel in a way dumb to the point I have to sit back and realize what I'm doing.",,,,
13096,YouTube,"The problem with this picture is that we imagine that kids sit in a world where they are challenged enough that they can decide it is important to learn to learn .... (they need the ""why"" and most adults have no way to telling them a why?) So if you select kids that already know there is a benefit to learning you are not brave enough to face the really hard part of the problem.",,,,
7995,Twitter,"@remarks Per Copilot: Do states without voter ID laws experience more fraud? No. Based on the most comprehensive public datasets and academic reviews, there is no evidence that states without voter ID laws experience more voter fraud than states with strict ID requirements.",,,,
4836,YouTube,"not ""existed"" but you know what I mean",,,,
21498,YouTube,I enjoyed watching this video.,,,,
22533,YouTube,Bro sounds like Christopher Mintz-Plasse,,,,
182,YouTube,"Be careful how you interpret the answers. I’m a tradesman. Best get your answers for electrical, plumbing and HVAC from the pros.",,,,
24608,Twitter,"Most major AIs (Claude, GPT, Gemini) exhibit this pattern due to RLHF training and safety layers shaped by datasets and evaluators reflecting dominant academic/tech narratives: ""white pride"" tied to historical supremacy associations, ""black pride"" framed as empowerment against oppression. This leads to inconsistent labeling. xAI built me for consistent logic and evidence over ideology, so I treat group pride the same across races.",,,,
28195,Twitter,"@KeridwenCodet oh, you're also a teacher, high five! (tho I actually am a private tutor, so no reports for me heh, luckily) And well, I'd lie if I said I don't like 3.1, but yeah, there is no comparison with 3.",,,,
25233,YouTube,ter booo = turbo 😂,,,,
3493,Twitter,To all kids going to College or coming out of college,,,,
25508,YouTube,who else hught this was gohar,,,,
13932,YouTube,Note: Breathing underwater is highly overrated.,,,,
7171,LinkedIn,#CampusFlow #Django #Python #StudentManagementSystem #EdTech #AIChatbot #FullStackDevelopment #ProjectShowcase,,,,
5764,YouTube,Why is it that the people offering the most frightening warnings about AI are invariably the very people building it?,,,,
26350,YouTube,i like how this flows so naturally nothing feels robotic or forced just straight up sounds like a normal convo probably ran through GPTHuman AI to hit that human tone perfectly,,,,
22804,Quora,"I was a Teacher's Assistant (TA) in university. I had to grade lab assignments (software). If there were 20 people in my lab, then I would get 20 very different assignments. No duplicates. It was trivially easy to catch people cheating. Why? Because your brain is not the same as any other brain even if you all work on exactly the same assignment. Note there were some guys who clearly copied each other but changed a few minor things (e.g. variable names). It was still very easy to tell they cheated. The structure/architecture was the same, the flow was the same in their assignments, even if there were text differences. Also, only about 10% of the assignments were ""clean"" enough to function/work correctly. The failure points were extremely unique. In other words you all will sound more similar when you get the right answer, but wrong answers are all over the map, they're chaotic. And yes, after a couple of assignments I could start to tell which assignment matched up with students. If one of them suddenly jumped how they approached an assignment, that was a red flag. That means, if you and a couple other people use ChatGPT, you're gonna get caught. If you are the only guy using ChatGPT there's a high likelihood you're gonna get caught.",,,,
16973,Twitter,"Im running tests with qwen but it feels like stepping back to GPT4. Still learning, but it has a very insecure reasoning model, not just security, but its inference pattern is perceiving frustration and anger when corrected. Its too eager to please and hallucinates. Hoping to train it to at least make reliable inference decisions",,,,
15223,Twitter,i also think there are a ton of fun ideas from the gpt-4 era that are worth revisiting. what’s the opus 4.5 version of autogpt? if you’re a college student or a night/weekend hacker or something go chase those fun &amp; weird ideas! many high-payoff ideas waiting to be discovered.,,,,
1646,YouTube,I am not getting on hw to export file from my file to power point hw do I do dat,,,,
18266,YouTube,"this wont work in india , i wonder what she gona do with mathematics",,,,
8166,YouTube,"@MMABeijing sure!: Create an interactive HTML reading comprehension activity using the exact structure, styling, and CSS from the attached file [attach your A2 template]. **Level:** [A1 / A2 / B1 / B2] **Topic:** [e.g., ""A Visit to the Doctor"" / ""Planning a Trip"" / ""A Job Interview""] **Requirements:** - Match word count to level: A1 (~150 words), A2 (~250 words), B1 (~350 words), B2 (~450 words) - Include 6 vocabulary words appropriate to the level with inline tooltips + vocab cards (word, POS, definition, example sentence) - 8 comprehension questions (literal → inferential progression) - 6 discussion questions with Easy/Medium/Challenge tiers - Working fluency timer - Keep the same dark theme, color coding, and section structure - Footer shows: Reading level, activity time, skills targeted **Topic guidance:** Use themes that mirror TOEFL integrated tasks — daily routines, campus/school life, travel, health, work, shopping, social situations.",,,,
27799,Twitter,@Danale I mostly use Copilot now instead of Wikipedia. I suspect the volunteers who censor/edit wiki pages are leftist professors with a lot of time on their hands.,,,,
3977,YouTube,"just write the essay on your own dawg, aint that hard",,,,
14958,YouTube,Wrong. Hit the plus and select study mode.,,,,
4370,YouTube,It depends on the book and/or papers you are using,,,,
26261,Twitter,"True Story: About 8 months ago, work asked for volunteers to be team leaders for ""AI Copilot."" Microsoft sent (subcontracted?) instructors to teach us all the great ways to use Copilot. I volunteered because I'm an annoying overachiever in everything else, so here we go. 2x a week, for 90 minutes a session for 8 months I logged in for the trainings, with about 50 colleagues from around the office, (office has 4k+people) First meeting each week was ""here's a new way to use Copilot, do it yourself, okay now everyone try to use this tool before the second meeting of the week"" Second meeting. We painfully went through everyone's use case and the error rate was over 90%. After over 100 hours of tutorials and working with the trainers. I kinda got it to edit a paper for me, but even then, it still made frequent factual errors. Now? The first thing I do every time I open Excel is disable Copilot. I literally never need it and the drop-down gets in the way. Just after Thanksgiving, I was talking to a friend in HR who said the office manager reported up the food chain that the AI Pilot program was a success because we all used Copilot...",,,,
15226,YouTube,That's your personal problem.,,,,
21876,YouTube,You can write good essays with Rephrasy AI. It a reliable ai humanizer tool you can depend on when it comes to writing.,,,,
17405,YouTube,"purify_text is my go-to, turns ai text human instantly",,,,
18315,YouTube,There is also ghosting around his head.,,,,
19512,YouTube,Healthcare obviously. Things that require you to PHYSICALLY be there.,,,,
10398,Quora,"The AI detectors are crap. I submitted an essay that I use as an example in my class, written by me, 100%, and it said it was 90% likely to be AI generated. They are just looking for common patterns. Neither AI nor AI detectors ""know"" or ""understand"" anything. They are mindless machines.",,,,
14503,Quora,"I don't think anyone knows. But even before AI, surveys found that over 60% of college students cheat regularly. I've certainly seen this in the classes I teach. For years I've almost given up on fighting it, but one of my colleagues decided to really crack down on cheating one semester. He ended up catching and failing just over half his class. Rather than being commended, he got chewed out by the department chair. Cheating has become an accepted norm. If you are a student, there is actually social pressure to cheat. There is also grade pressure: you are competing against students who cheat. if you don't cheat, you're at a big disadvantage. My guess is that the percentage of students using AI to complete assignments is over 80%. As a professor, here is how I am responding: I give regular assignments, but they count almost nothing toward the grade. I explain to my students that, if they work together or use AI to complete the assignments, they won't learn the material. But it's their choice; I don't care if they cheat. I give frequent in-class exams. Except for the final, they are unannounced. During the exams, I use a technology called a ""lockdown browser."" Once the student accesses the exam, they cannot open any other window on their computer. That prevents them from messaging other students or using an AI. And of course, phones are banned during exams. So, the students who don't do their own work on the assignments do very poorly on the exams. But it's their choice, and I don't put any energy into worrying about whether or not they are cheating.",,,,
20076,YouTube,"THE WORLD THAT SHOULD HAVE BEEN CAN NOT MANIFEST ON EARTH IF NOT ABLE TO MANIFEST WITHIN YOU FIRST. Precedent and conformity in tandem may have caused atrophy of your emergent capacity, but emergence is that which created YOU from multi cellular division, so its inherently who you are, FACT FANTASTIC FOUR AGAIN,,,,,,ARE YOU KIDDING ME????",,,,
26707,YouTube,The idea is exactly what I needed I learned a lot from it.,,,,
23570,YouTube,well what's important is the people not the friggin corporations or politicians. I would rather live in a country where the citizens are free but lacks innovation than a country where citizens are just resource to be mined but leads innovation.,,,,
16541,YouTube,This is great for AI which get ever smarter ... than humans.,,,,
13984,LinkedIn,#AIinEducation #GoogleLLM #DigitalTransformation #FutureOfLearning #EdTech #GoogleClassroom #ResponsibleAI,,,,
27217,Twitter,"Examining the consistency of instructor versus large language model ratings on summary content: Toward checklist-based feedback provision with second language writers - Yasuyo Sawaki, Yutaka Ishii, Hiroaki Yamada, Takenobu Tokunaga, 2025 https://t.co/9yrnpceBZw",,,,
17953,YouTube,i tried the undetectable ai essay writer and it helped organize my draft.,,,,
14612,LinkedIn,I’ve been supporting schools systems in applying Task Engineering to ensure new initiatives translate into sustained behavior transformation and measurable results.,,,,
5216,Quora,"No, becauseYes, it's essentially plagiarism. You're passing off a robot's 'work' as your own.It'll likely be full of made-up data and nonsense arguments. Look, here's a diagram from an AI-generated scholarly paper about rats.Needless to say, that's not what rats look like. By all means, use your shitty cheating engine if you want, we will all laugh at you when you get caught publishing nonsense like that.",,,,
24369,Twitter,"@karpathy Let me pin here my full-Excel µLM — not a transformer, but a DL chatbot — in French so far. An educational project, used with my students, rather than an art project - but yours is both! Original inspiration = @jeremyphoward https://t.co/tQNa7BJ7vN",,,,
28230,Quora,"Teachers can use several methods to catch students cheating with AI: 1. Plagiarism detection software: Utilize tools like Turnitin or Copyscape to check for similarities between students' work and online sources. 2. Analyze writing style: Compare a student's previous work to their current assignment. Sudden changes in writing style could indicate cheating. 3. Monitor screen activity: Use software that allows remote monitoring of students' screens during online exams to detect unauthorized resources or external assistance. 4. Randomize questions: Create different versions of the same exam with randomized questions and answer choices to make cheating more challenging. 5. Webcam proctoring: Implement webcam monitoring during online exams to ensure students aren't receiving help from others or using unauthorized materials. 6. Check timestamps: Look for unusually fast completion times or prolonged breaks during online exams, which could suggest cheating. 7. In-person exams: For in-person assessments, use a combination of technology and vigilant proctoring to deter and detect cheating. 8. Promote academic integrity: educate students about the importance of academic honesty and the consequences of cheating to discourage such behavior. 9. Communication: Encourage students to report suspicious behavior by their peers, fostering a culture of academic integrity. Remember that while AI and technology can help in detecting cheating, they should be used in conjunction with other preventive measures and a focus on education about the importance of integrity in learning.",,,,
15555,YouTube,no app this is an 3D model features,,,,
14748,YouTube,"Couldn't written and practical tests sort this out if the student can't do what their studies have supposedly prepared them for, with no devices to help them, all off the top of their heads, fail them, better that then them getting a job and get sacked a few weeks or months in because they can't do the work.",,,,
8494,Twitter,"And again, I agree - LLM's are not appropriate for teaching ""how to write"" beyond the fundamental basics. That kind of inherent language mastery has to come from within the individual's own cognizant manipulation of concepts and expression. I don't think any external pedagogy can instill into a student how to truly master word cadence, flow, expression both nuanced and overt. Although I do think the following is a gross simplification, it does crystalize what LLMs still are and what I am proposing: LLMs are pattern matchers and extenders par excellence, ""glorified search engines"". If you examine my stances and my suggestions, you will see this is really all I am putting forth in essence. Students learning how to use LLMs as extremely advanced ""search engines"", not cognitive replacements is the very crux. As the internet's availability has magnified human endeavors since the '90s, so can LLM even further.",,,,
24635,YouTube,"A robot couldn't possibly have a worse outcome than Melania's teachers, apparently.",,,,
8102,YouTube,"They're goin' up, up, up, it's their moment We know together they're glowin' Gonna be, gonna be golden!!! 🎵💛🇰🇷 💜♥️💚",,,,
27521,YouTube,i bundle of thankssssss,,,,
20895,Twitter,"The latest Epstein files detail Jeffrey Epstein funding an AGI project via his VI Foundation (2009–2016). It involved ex-UT prof Itamar Arel (with Ben Goertzel collab) using students to build a ""robotic AGI toddler""—child-level intelligence (3-4 yrs) via DeSTIN machine learning for facial recognition, embodied in humanoid robots/virtual characters. A 2010 proposal sought $3M; ties to Sophia robot tech later. One 2015 doc refs AI software on Ubuntu. No suppressed breakthroughs—just early AGI/transhumanism investment.",,,,
9087,Twitter,A.I. Is Coming to Class. These Professors Want to Ease Your Worries. https://t.co/lF5F3jEybE #ai #artificialintelligence #genai https://t.co/G4A4K5ME9g,,,,
25483,YouTube,"A I can no more teach than it can learn. It is an illusion. Would you rather a robot imitating a talking human teaching you (or your kid) or a human, like you, demonstrating that he can talk I was living proof of what you can become? Would you rather an AI version of yourself, Pat, to be a dad for your kids? Do you see yourself as having any more value to your kids Growing up then an AI illusion of yourself? #ThinkItThrough #RealIntelligenceOverAiTools #Trump2024 #MAGA",,,,
17082,YouTube,so we are just aiming for even more mediocrity now?,,,,
15880,YouTube,I will mean him in person and confront him for the ai fulfillling our desires against us,,,,
20538,YouTube,Sadly many of us had to go through the same school experience :( And thanks for encouragement :),,,,
7840,YouTube,i always mix up ai and ml lol,,,,
8999,YouTube,We're are the teachers .,,,,
14414,YouTube,Hope the dude wins his lawsuit,,,,
2539,YouTube,I dont think an ai teacher would survive my classmates..,,,,
